author,publishdate,title,description,upvote
Karlijn Willems,2019-03-27,How to Make a Histogram with ggvis in R,Learn how to make a histogram with ggvis. Go from the very basics to creating interactive graphs with shiny to display distributions.,37
Adolfo Álvarez,2019-03-25,R Packages: A Beginner's Guide ,An introduction to R packages based on 11 of the most frequently asked user questions. ,71
Francisco  Javier Carrera Arias,2019-03-22,Beginners Guide to SQLite,Learn the basics of SQLite databases from SQLite dot commands to an example of their practical applications using the command line interface.,16
Karlijn Willems,2019-03-21,18 Most Common Python List Questions,"Discover how to create a list in Python, select list elements, the difference between append() and extend(), why to use NumPy and much more.",92
Sayak  Paul,2019-03-20,Introduction to SQL Joins,"In this tutorial, you'll learn about the mechanics of joins in SQL and its different types.",21
Karlijn Willems,2019-03-18,Importing Data Into R - Part Two,"A tutorial on importing data into R. The focus is on reading data from sources like statistical software, databases, webscraping, and more.",22
Sayak  Paul,2019-03-15,Introduction to the Where Clause in SQL,"In this tutorial, you will be introduced to filtering rows in SQL using the where clause.",9
Francisco  Javier Carrera Arias,2019-03-13,Data Wrangling with VLOOKUP in Spreadsheets,"In this tutorial, you will get an overview of how to use the VLOOKUP function and also a basic explanation of INDEX-MATCH.",15
Sayak  Paul,2019-03-12,SQLite in Python,"In this tutorial, you will learn about using SQLite, an extremely light-weight Relational database management system (RDBMS) in Python.",30
Karlijn Willems,2019-03-11,How to Make a Histogram with ggplot2,Learn how to make a histogram with ggplot2 in R. Make histograms in R based on the grammar of graphics.,25
Karlijn Willems,2019-03-08,How to Make a Histogram with Basic R,Tutorial for new R users whom need an accessible and easy-to-understand resource on how to create their own histogram with basic R.,24
Ryan Sheehy,2019-03-07,Video: Intro to Python for Spreadsheet Users,"In this video tutorial, you'll watch the end-to-end automation of a routine spreadsheet task being completed using Python.",44
Ryan Sheehy,2019-03-06,Video: Tidyverse Exploratory Analysis,"In this video tutorial, you'll be given a brief introduction to the concept of the tidyverse and then walk through an exploratory analysis.",17
Parul Pandey,2019-03-05,SQL with Tableau,"In this tutorial, you will learn how to connect Tableau to a Microsoft SQL Server database and then analyze the data to get insights.",22
Sayak  Paul,2019-03-04,Introduction to the ALTER TABLE Statement in SQL,"In this tutorial, you will learn how to use and apply the ALTER TABLE statement in SQL.",14
Avinash Navlani,2019-03-01,Views (Virtual Tables) in SQL,"In this tutorial, you will learn what views are, the different types available, and the pros and cons of using them.",19
Adam Spannbauer,2019-02-28,Intro to Multiple Inheritance & super(),"A Pythonista's introductory guide to multiple inheritance, the super() function, & how to navigate the diamond problem.",30
Sayak  Paul,2019-02-27,Using ORDER BY Keyword in SQL,"In this tutorial, you will learn how to use and apply the ORDER BY keyword in SQL.",12
Karlijn Willems,2019-02-25,Python Machine Learning: Scikit-Learn Tutorial,An easy-to-follow scikit-learn tutorial that will help you get started with Python machine learning. ,182
Sayak  Paul,2019-02-22,Installing PostgreSQL on Windows and Mac OS X,"In this tutorial, you will learn how to install PostgreSQL on two different operating systems - Windows and Mac. ",13
Parul Pandey,2019-02-21,Spreadsheets with Tableau,"In this tutorial, you will learn how to analyze and display spreadsheet data using Tableau and make more data-driven decisions.",27
Sayak  Paul,2019-02-15,Working with Spreadsheets in SQL,"In this tutorial, learn how to import a spreadsheet into PostgreSQL and perform analysis on it. ",14
Ryan Sheehy,2019-02-14,Getting Started with Spreadsheets,This tutorial will give you a basic understanding of the terminology in spreadsheets along with learning how to create a basic table.,8
Karlijn Willems,2019-02-12,keras: Deep Learning in R,"In this tutorial to deep learning in R with RStudio's keras package, you'll learn how to build a Multi-Layer Perceptron (MLP).",98
Sayak  Paul,2019-02-07,Managing Databases in PostgreSQL,"In this tutorial, you will learn how to create, drop and select a database in SQL.",15
Francisco  Javier Carrera Arias,2019-02-06,Fuzzy String Matching in Python,"In this tutorial, you will learn how to approximately match strings and determine how similar they are by going over various examples.",115
Sayak  Paul,2019-02-05,Beginner's Guide to PostgreSQL,"In this tutorial, you will learn how to write simple SQL queries in PostgreSQL. ",29
Carlo Fanara,2019-02-01,A Tutorial on Using Functions in R!,"The tutorial highlights what R functions are, user defined functions in R, scoping in R, making your own functions in R, and much more.",41
Sejal Jaiswal,2019-01-31,Python time.sleep() Function,"In this tutorial, you will learn how the time.sleep() function operates and how to apply it in your program.",14
Avinash Navlani,2019-01-30,GROUP BY and HAVING Clause in SQL ,"In this tutorial, you will learn about the GROUP BY and HAVING Clause along with going over examples on how to put them to use.",38
Karlijn Willems,2019-01-29,15 Questions All R Users Have About Plots,"There are different types of R plots, ranging from the basic graph types to complex types of graphs. Here we discover how to create these.",25
Michael Ritchie,2019-01-28,Reducing Rework as a SQL Data Analyst,"In this tutorial, you will learn how to maximize your time in SQL to become more productive.",26
Karlijn Willems,2019-01-17,SQL Tutorial: How To Write Better Queries,"Learn about anti-patterns, execution plans, time complexity, query tuning, and optimization in SQL.",159
Karlijn Willems,2019-01-16,TensorFlow Tutorial For Beginners,"Learn how to build a neural network and how to train, evaluate and optimize it with TensorFlow",368
Carlo Fanara,2019-01-15,Tutorial on the R Apply Family,"In this tutorial, you'll learn about the use of the apply functions in R, its variants, and a few of its relatives applied to different data structures.",124
Karlijn Willems,2019-01-14,Pandas Tutorial: DataFrames in Python,"Explore data analysis with Python. Pandas DataFrames make manipulating your data easy, from selecting or replacing columns and indices to reshaping your data.",312
Hafsa Jabeen,2019-01-11,Making Web Crawlers Using Scrapy for Python,"Develop web crawlers with Scrapy, a powerful framework for extracting, processing, and storing web data.",60
Debbie Liske,2019-01-09,Lyric Analysis: Predictive Analytics using Machine Learning with R,"In this tutorial, you'll learn how to use predictive analytics to classify song genres.",41
Nishant Singh,2019-01-04,Hypothesis Testing in Machine Learning,"In this tutorial, you'll learn about the basics of Hypothesis Testing and its relevance in Machine Learning.",15
Avinash Navlani,2018-12-28,Decision Tree Classification in Python,"In this tutorial, learn Decision Tree Classification, attribute selection measures, and how to build and optimize Decision Tree Classifier using Python Scikit-learn package.",89
Sayak  Paul,2018-12-26,Beginner's Guide to Google's Vision API in Python,"Learn what Vision API is and what are all the things that it offers. By the end of this tutorial, you will also learn how you can call Vision API from your Python code.",18
Paulo Henrique Vasconcellos,2018-12-21,Top 5 Python IDEs For Data Science,The best Python IDEs for data science that make data analysis and machine learning easier!,143
Nishant Singh,2018-12-21,Overview of Encoding Methodologies,"In this tutorial, you will get a glimpse of encoding techniques along with
some advanced references that will help you tackle categorical variables.",10
Nishant Singh,2018-12-21,Overview of Encoding Methodologies,"In this tutorial, you will get a glimpse of encoding techniques along with
some advanced references that will help you tackle categorical variables.",10
Avinash Navlani,2018-12-20,Customer Lifetime Value,"In this tutorial, learn how to calculate Customer Lifetime Value in Python.",30
Parul Pandey,2018-12-20,Face Detection with Python using OpenCV,This tutorial will introduce you to the concept of object detection in Python using OpenCV library and how you can utilize it to perform tasks like Facial detection.,30
Sayak  Paul,2018-12-19,Understanding Recursive Functions in Python,"In this tutorial, learn about the different aspects of recursive functions and implement a recursive function in Python from scratch. ",20
Sayak  Paul,2018-12-18,Introduction to Indexing in SQL,"In this tutorial, learn about indexing in databases and different types of indexing techniques. ",33
Hafeezul Kareem Shaik,2018-12-18,Property vs. Getters and Setters in Python ,"In this tutorial, you will learn what the difference is between Python Property and Getters & Setters. ",15
Łukasz Deryło,2018-12-13,Contingency Tables in R,"In this tutorial, you'll learn how to create contingency tables and how to test and quantify relationships visible in them.",19
Olivia Smith,2018-12-12,GIT SETUP: The Definitive Guide,"In this tutorial, you'll learn how to set up Git on your computer in different operating systems.",29
Aditya Sharma,2018-12-12,Introduction to Deep Learning in Python,Learn the basics of deep learning and neural networks along with some fundamental concepts and terminologies used in deep learning.,31
Patrick David,2018-12-11,"Stocks, Significance Testing & p-Hacking","Learn how to manipulate time series data with pandas and conduct significance testing through simulation using Python, to analyze stock market volatility.",19
Nishant Singh,2018-12-11,Introduction to H2O AutoML,"In this tutorial, you will learn about H2O and have a glimpse of its autoML functionality.",15
Derrick Mwiti,2018-12-10,Introduction to Python Metaclasses,"In this tutorial, learn what metaclasses are, how to implement them in Python, and how to create custom ones.",20
Kyle O'Shea,2018-12-05,Shareable Data Science with Kyso,"In this tutorial, you’ll learn how to create publishable and reproducible data science studies on Kyso’s platform, using interactive plotly visualizations. ",18
Avinash Navlani,2018-12-04,Naive Bayes Classification using Scikit-learn,Learn how to build and evaluate a Naive Bayes Classifier using Python's Scikit-learn package.,54
Anubhav Singh,2018-11-30,Introduction to Reinforcement Learning,"In this tutorial, you'll learn the basic concepts and terminologies of reinforcement learning. At the end of the tutorial, we'll discuss the epsilon-greedy algorithm for applying reinforcement learning based solutions.",40
Hafeezul Kareem Shaik,2018-11-29,Working With Zip Files In Python,"In this tutorial, you are going to learn how to work with Zip Files in Python using the zipfile module. zipfile is a Python built-in module.",10
Sayak  Paul,2018-11-28,Automated Machine Learning with Auto-Keras,Learn about automated machine learning and how it can be done with auto-keras.,16
Aditya Sharma,2018-11-27,Introduction to Machine Learning in Python,"In this tutorial, you will be introduced to the world of Machine Learning (ML) with Python. To understand ML practically, you will be using a well-known machine learning algorithm called K-Nearest Neighbor (KNN) with Python.",43
Nishant Singh,2018-11-26,Comparison of BI and Analytics Platforms,"In this tutorial, you will learn about different factors that are taken
into consideration before choosing your Analytics Platform both at the
organization and individual level.",9
Sejal Jaiswal,2018-11-21,Overview of Atom IDE,"In this tutorial, you'll learn the importance of IDEs, how to set-up Atom, and download packages.",12
Karlijn Willems,2018-11-20,Machine Learning in R for beginners,This small tutorial is meant to introduce you to the basics of machine learning in R: it will show you how to use R to work with KNN.,130
Carlo Fanara,2018-11-20,A Tutorial on Loops in R - Usage and Alternatives,A tutorial on loops in R that looks at the constructs available in R for looping. Discover alternatives using R's vectorization feature.,69
Karlijn Willems,2018-11-20,This R Data Import Tutorial Is Everything You Need,Comprehensive and easy R Data Import tutorial covering everything from importing simple text files to the more advanced SPSS and SAS files.,53
Avinash Navlani,2018-11-20,AdaBoost Classifier in Python,"Understand the ensemble approach, working of the AdaBoost algorithm and learn AdaBoost model building in Python.",24
Aditya Sharma,2018-11-15,Differences Between Machine Learning & Deep Learning,"In this tutorial, you'll get an overview of Artificial Intelligence (AI) and take a closer look in what makes Machine Learning (ML) and Deep Learning different.",70
Asael Alonzo Matamoros,2018-11-09,Introduction to Monte Carlo Methods,"In this tutorial, the reader will learn the Monte Carlo methodology and its applications in data science, like integral approximation, and parameter estimation.",58
Derrick Mwiti,2018-11-02,JSON Data in Python,"In this tutorial, you'll learn how to use JSON in Python.",30
Sayak  Paul,2018-10-31,Essentials of Linear Regression in Python,Learn what formulates a regression problem and how a linear regression algorithm works in Python.,44
Derrick Mwiti,2018-10-30,Introduction to MongoDB and Python,"In this tutorial, you'll learn how to integrate MongoDB with your Python applications.",26
Tom Jeon,2018-10-29,Merging Datasets in R,"In this tutorial, you'll learn to join multiple datasets in R.",15
Hafeezul Kareem Shaik,2018-10-26,Role of Underscore(_) in Python,"In this tutorial, you're going to learn about the uses of underscore(_) in python. ",52
Sayak  Paul,2018-10-25,Turning Machine Learning Models into APIs in Python,Learn to how to create a simple API from a machine learning model in Python using Flask.,115
Duong Vu,2018-10-24,Introduction to Geospatial Data in Python,"In this tutorial, you will use geospatial data to plot the path of Hurricane Florence from August 30th to September 18th. ",67
Hafsa Jabeen,2018-10-23,Stemming and Lemmatization in Python,This tutorial covers the introduction to Stemming & Lemmatization used in Text and Natural Language Processing.,61
Ryan Sheehy,2018-10-18,Autocorrelation in R,Practice autocorrelation in R by using course material from DataCamp's Introduction to Time Series Analysis course.,13
Ryan Sheehy,2018-10-18,Basic Programming Skills in R,Practice basic programming skills in R by using course material from DataCamp's free Model a Quantitative Trading Strategy in R course.,8
Salin Kc,2018-10-18,Time Series Analysis using R,Learn Time Series Analysis with R along with using a package in R for forecasting to fit the real-time series to match the optimal model.,32
Derrick Mwiti,2018-10-16,Decorators in Python,"In this tutorial, learn how to implement decorators in Python.",64
Hillary Green-Lerman,2018-10-16,Hacking Date Functions in SQLite,"In this tutorial, learn how to use date functions in SQLite.",6
Ryan Sheehy,2018-10-15,Ordering and Subsetting Factors,This tutorial takes course material from DataCamp's Introduction to R for Finance course and allows you to practice ordering and subsetting factors.,5
Ryan Sheehy,2018-10-15,Introduction to Data frames in R,This tutorial takes course material from DataCamp's Introduction to R course and allows you to practice data frames. ,6
Sayak  Paul,2018-10-15,Introduction to Cyclical Learning Rates,Learn what cyclical learning rate policy is and how it can improve the training of a neural network.,16
Hillary Green-Lerman,2018-10-15,Supercharge Your Subqueries,"In this tutorial, you'll learn how to create subqueries in SQL to better analyze and report data.",10
Ryan Sheehy,2018-10-15,Understanding Confusion Matrix in R,This tutorial takes course material from DataCamp's Machine Learning Toolbox course and allows you to practice confusion matrices in R.,8
Ryan Sheehy,2018-10-15,Data Frames in R,This tutorial takes course material from DataCamp's Introduction to R for Finance course and allows you to practice Data Frames.,5
,2018-10-12,Facets for ggplot in R,"In this tutorial, you'll learn how to make the most of ggplots facetting functions.",13
Rohit Peesa,2018-10-11,Machine Learning Black Friday Dataset,"In this tutorial, you will gain knowledge on filling null values, preprocessing data, reducing dimensionality using PCA, and split data using K-Fold.",26
Samip Katwal,2018-10-10,Using PostgreSQL in Python,"In this tutorial, you will be learning about the database in Python, with a few examples in PostgreSQL Database.",24
Avinash Navlani,2018-10-09,Latent Semantic Analysis using Python,"In this tutorial, you will learn how to discover the hidden topics from given documents using Latent Semantic Analysis in python.",35
Łukasz Deryło,2018-10-09,Bootstrap in R,"In this tutorial, you will learn how to use the boot package to obtain different types of bootstrapped confidence intervals. ",17
Tom Jeon,2018-10-08,Subsetting Datasets in R,Subsetting datasets is a crucial skill for any data professional. Learn and practice subsetting data in this quick interactive tutorial!,10
Vedabrata Basu,2018-10-05,Contingency Analysis using R,"In this tutorial, you'll learn with the help of an example how ""Contingency Analysis"" or ""Chi-square test of independence"" works and also how efficiently we can perform it using R.",40
Sayak  Paul,2018-10-04,Diving Deep with Imbalanced Data,Learn the techniques to deal with an imbalanced dataset.,20
Amita Kapoor,2018-10-02,Social Network Analysis in Python,Networks today are part of our everyday life. Let's learn how to visualize and understand a social network in Python using Networks.,61
Ryan Sheehy,2018-09-28,Using Regular Expressions to Clean Strings,This tutorial takes course material from DataCamp's Cleaning Data in Python course and allows you to clean strings using regular expressions.,6
Sayak  Paul,2018-09-27,Demystifying Crucial Statistics in Python,Learn about the basic statistics required for Data Science and Machine Learning in Python.,50
Ryan Sheehy,2018-09-27,Factor Levels in R,This tutorial takes course material from DataCamp's free Intro to R course and allows you to practice Factors.,16
Ryan Sheehy,2018-09-27,Creating a List in R,Practice Lists in R by using course material from DataCamp's Intro to R course.,8
Avinash Navlani,2018-09-26,Introduction to Customer Segmentation in Python,"In this tutorial, you're going to learn how to implement customer segmentation using RFM(Recency, Frequency, Monetary) analysis from scratch in Python.  ",44
Ryan Sheehy,2018-09-26,For Loops in R,Practice For Loops in R by using course material from DataCamp's Intermediate R for Finance course.,13
Parul Pandey,2018-09-24,Data Visualisation with Tableau,"In this tutorial, you will learn how to analyze and display data using Tableau and make better, more data-driven decisions. ",77
Nishant Singh,2018-09-21,Debug With debugr,"In this tutorial, you will learn about debugging in R and Rstudio using the debugr package.",6
Manish Pathak,2018-09-21,TPOT in Python,"In this tutorial, you will learn how to use a very unique library in python, tpot . The reason why this library is unique is that it automates the entire Machine Learning pipeline and provides you with the best performing machine learning model.",51
Manish Pathak,2018-09-19,Joining DataFrames in Pandas,"In this tutorial, you’ll learn various ways in which multiple DataFrames could be merged in python using Pandas library.",66
Sheraz Salahuddin,2018-09-17,Using Python BeautifulSoup to scrape DataCamp Tutorials & Analyze,"In this tutorial, we are going to scrape the tutorials section of the DataCamp website and try to get some insights.",53
Manish Pathak,2018-09-13,Introduction to t-SNE,"In this tutorial, you’ll learn about the recently discovered Dimensionality Reduction technique known as t-Distributed Stochastic Neighbor Embedding (t-SNE).",75
Sayak  Paul,2018-09-12,Investigating Tensors with PyTorch,"In this tutorial, you'll learn about Tensors, PyTorch, and how to create a simple neural network with PyTorch.",26
Sejal Jaiswal,2018-09-12,Lists: N-Sized Chunks,"In this tutorial, you shall work with lists and learn an efficient way to divide arbitrarily sized lists into chunks of a given size.",6
Hafsa Jabeen,2018-09-11,SQL: Reporting and Analysis,"Master SQL for Data Reporting & daily data analysis by learning how to select, filter & sort data, customize output, & how you can report aggregated data from a database!",43
Ahmed Gad,2018-09-11,Deduce the Number of Layers and Neurons for ANN,There is an optimal number of hidden layers and neurons for an artificial neural network (ANN). This tutorial discusses a simple approach for determining the optimal numbers for layers and neurons for ANN's.,20
Sayak  Paul,2018-09-06,Ensemble Learning in Python,"In this tutorial, you'll learn what ensemble is and how it improves the performance of a machine learning model.",34
Michał Oleszak,2018-09-05,Visualize Missing Data with VIM Package,Learn to use data visualization tools provided by the VIM package to gain quick insights into the missing data patterns.,17
Hadrien Jean,2018-09-04,Machine Learning Basics - The Norms,Learn linear algebra through code and visualization.,21
,2018-08-31,Tidyverse Soccer Score Analysis,"In this tutorial, we'll use tidyr, dplyr, and ggplot2 to visualize a season of soccer scores, and investigate trends in the time of goals scored and conceded.",10
Francisco  Javier Carrera Arias,2018-08-30,Markov Chain Analysis in R,"In this tutorial, you'll learn what Markov chain is and use it to analyze sales velocity data in R.",24
Sayak  Paul,2018-08-29,Towards Preventing Overfitting: Regularization,Learn the basics of Regularization and how it helps to prevent Overfitting. ,30
Elliot Hershberg,2018-08-28,Tidy Analysis of Pew Research Data Using R,"Learn how to access data from the Pew Research Center, load it into R & then how to explore the data using the Tidyverse ecosystem.",11
J. Andrés Pizarro,2018-08-28,Python Setup: The Definitive Guide,"In this tutorial, you'll learn how to set up your computer for Python development, and explain the basics for having the best application lifecycle.",41
Nishant Singh,2018-08-27,Detect Anomalies with Anomalize in R,Learn how to detect anomalies in large time series data sets and present insights in a much simpler way.,7
Théo Vanderheyden,2018-08-24,Operators in Python,"This tutorial covers the different types of operators in Python, operator overloading, precedence and associativity.",13
Minoo Ashtiani,2018-08-23,Introduction to Bioconductor,Learn how to perform computational and statistical analysis on the results of your biological experiment.,17
James Le,2018-08-22,Support Vector Machines in R,"In this tutorial, you'll try to gain a high-level understanding of how SVMs work and then implement them using R.",26
Hafsa Jabeen,2018-08-21,Market Basket Analysis using R,Learn about Market Basket Analysis & the APRIORI Algorithm that works behind it. You'll see how it is helping retailers boost business by predicting what items customers buy together.,65
Saneep Khatri,2018-08-21,Analyzing Complexity of Code through Python,"Get introduced to Asymptotic Analysis. Learn more about the complexity of the algorithm as well as asymptotic notation, such as Big O, Big θ, and Big Ω notation. Along with the examples of complexity in a different algorithm.",14
Nishant Singh,2018-08-20,Data Visualization with Highcharter in R,Learn how to use Highcharter to create a visualization that creates a buzz.,22
Kyle Weller,2018-08-17,Remote Python and R in SQL,Learn how to remotely send R and Python execution to a SQL Server from Jupyter Notebooks.,8
Derrick Mwiti,2018-08-16,Dash for Beginners,Learn how to build dashboards in Python using Dash.,62
Sayak  Paul,2018-08-15,Hyperparameter Optimization in Machine Learning Models,This tutorial covers what a parameter and a hyperparameter are in a machine learning model along with why it is vital in order to enhance your model’s performance.,43
Avinash Navlani,2018-08-14,Predicting Employee Churn in Python,"Analyze employee churn. Find out why employees are leaving the company, and learn to predict who will leave the company.",54
Rohit Peesa,2018-08-13,Datasets from Images,"This tutorial will demonstrate how you can make datasets in CSV format from images and use them for Data Science, on your laptop.",13
Luke Hayden,2018-08-09,Principal Component Analysis in R,"In this tutorial, you'll learn how to use PCA to extract data with many variables and create visualizations to display that data.",180
Sejal Jaiswal,2018-08-08,"Python IF, ELIF, and ELSE Statements","In this tutorial, you will learn exclusively about Python if else statements.",16
Keith Singleton,2018-08-07,MeetUp API,"In this tutorial, you’ll learn how to pull data directly from MeetUp’s API using Python and write it into a JSON.",10
Aditya Sharma,2018-08-06,Image Super-Resolution using Multi-Decoder Framework,"In this tutorial, you’ll implement a medical imaging using deep learning paper with Python in Keras.",12
Sayak  Paul,2018-08-03,DBSCAN: A Macroscopic Investigation in Python,"Cluster analysis is an important problem in data analysis. Data scientists use clustering to identify malfunctioning servers, group genes with similar expression patterns, or various other applications.",21
Avinash Navlani,2018-08-02,KNN Classification using Scikit-learn,Learn K-Nearest Neighbor(KNN) Classification and build KNN classifier using Python Scikit-learn package.,63
